{
  "apiVersion": 2,
  "tier": "system",
  "version": "1.0.0",
  "publisher": "atmos",
  "displayName": "Wallpaper",
  "requires": {
    "extensions.manifest": 1,
    "lifecycle.context": 1,
    "state.namespaced": 1,
    "renderer.capabilities": 1,
    "surface.workspace": 1,
    "context-menu.contributions": 1,
    "settings.appearance-contributions": 1
  },
  "permissions": {
    "browser": [
      "clipboard-read"
    ]
  }
}
