{
  "displayName": "Currency",
  "description": "Exchange rates and money formatting for other extensions.",
  "apiVersion": 2,
  "tier": "first-party",
  "version": "1.0.0",
  "publisher": "atmos",
  "requires": {
    "extensions.manifest": 1
  },
  "permissions": {
    "network": [
      "cdn.moneyconvert.net"
    ]
  },
  "library": true
}
